questionid,zone_name,diffrank,catname,question,answer1,answer2,answer3,right,response
16885,General Knowledge,2,Video Games,"What is the name of the company that hosted the tournament in ""Killer Instinct""?",Supertech,Megatech,Gigatech,Ultratech,"Originally, ""Killer Instinct"" was an arcade-only game."
33516,General Knowledge,3,Video Games,"In ""Zelda 64"", who does Link say he would marry?",Saria,Ganon,Zelda,Ruto,"In ""Zelda 64"", when Link got the Zora Sapphire he said he would marry the Zora princess, Ruto."
40961,General Knowledge,2,Video Games,"In ""Street Fighter II"", which character has unusually stretchy limbs?",Stretch,Blanka,Akuma,Dhalsim,"In ""Street Fighter II"", Dhalsim's long kicks can reach almost half-way across the screen."
48134,General Knowledge,3,Video Games,"In ""Final Fantasy VIII"", who is sometimes referred to as being a lone wolf?",Ward Zabac,Cid Kramer,Zell Dincht,Squall Leonhart,"Thirteen weeks after its release, ""Final Fantasy VIII"" had earned more than U.S. $50 million in sales."
59950,General Knowledge,3,Video Games,"What band performs ""My Favorite Game"" in the introduction of ""Gran Turismo 2""?",Rob Zombie,Garbage,Pearl Jam,Cardigans,"In the video game ""Gran Turismo 2"", players can choose from nearly 650 different vehicles."
201787,General Knowledge,2,Video Game Machines,What was the GameCube's code name before it was released?,Cubix,Ultra 128,Mega Drive,Dolphin,GameCube will work with HDTVs but does not provide a high definition signal.
250990,General Knowledge,3,Online Gaming,How many different countries won medals at the World Cyber Games in 2004?,3,54,122,11,The number of countries participating in the World Cyber Games has risen from 17 in 2000 to 70 in 2006.
283578,General Knowledge,1,Computer Games,"In the game ""World of Warcraft"", what are you asked to do when you die?",Return To Checkpoint,Continue,Choose Human Or Zombie,Release Your Spirit,"In ""World of Warcraft"", you release your spirit when you die and become a ghost, and are transported to the nearest graveyard."
302933,General Knowledge,3,Board Game,"In the board game ""Sorry"", how many cards are you initially dealt?",Eight,Two,Five,Zero,"In the board game ""Sorry"", you draw a single card at a time from a pile rather than being dealt a hand initially."
324519,General Knowledge,2,Computer Games,"In the PC game ""Ancient Wars: Sparta"", which Spartan king makes an appearance?",Emperor Xerxes,King Philip,Alexander The Great,King Leonidas,"In the PC game ""Ancient Wars: Sparta"", famous figures from history make an appearance, such as the Spartan king Leonidas."
346773,General Knowledge,2,Computer Games,"On what planet do the events of ""Dawn of War: Dark Crusade"" take place?",Jupiter,Cyrene,Tartarus,Kronus,"In ""Dawn of War: Dark Crusade"", Kronus is a Necron tomb world whose inhabitants are beginning to awaken."
349156,General Knowledge,3,Arcade Video Games,"What evil genius resurrects people in the arcade game ""House of the Dead""?",Dr. Vently,Dr. Mezmer,Dr. Caligari,Dr. Curien,"The arcade game ""House of the Dead"" was created by Sega and released in 1997."
349170,General Knowledge,2,Arcade Video Games,"In ""Defender"", a direct hit to a Pod will break it up into what?",Podlings,Swarmettes,Mini Bombers,Swarmers,"Defender from the 1980's was included in the ""Williams Arcade's Greatest Hits"" game for PCs and PlayStations."
79901,General Knowledge,2,Abbreviations,What is the chemical formula for baking soda?,Caco2,Caco,Cacocl4,Nahco3,NaHCO3 is the chemical makeup of sodium bicarbonate.
385582,General Knowledge,2,Curiosities And Wonders,Which volcano is considered the largest in the world?,Mount St. Helens In Washington,Vesuvius In Italy,Mammoth Mountain In California,Mauna Loa In Hawaii,Mauna Loa rises 9.5 miles above its base under the sea.
232002,General Knowledge,2,Health And Fitness,"What is the longest, strongest bone in the body?",Humerus,Fibula,Ulna,Femur,"Spanning from the bottom of the hip to the top of the knee, the femur's name is from the Latin word for ""thigh""."
321355,General Knowledge,1,Herbal Medicines,"What herbal medicine, also known as goat weed, is used to treat depression? ",Chamomile,Lavender,Oregano,St. John's Wort,The herb St. John's Wort is also known by the names Klamath weed and hypericum.
90174,General Knowledge,1,Math - 4th Grade,"What number does the Roman numeral ""X"" stand for?",Five,One,50,10,Roman numerals were adapted from Etruscan numerals.
302026,General Knowledge,1,Math - 2nd Grade,How many seconds are there in 2 minutes?,2,200,60,120,"There are 86,400 seconds in a day."
76354,General Knowledge,2,Medicines And Medical,Which country pioneered heart transplant surgery?,Egypt,Nigeria,Kenya,South Africa,South African surgeons developed and performed the world's first heart transplant.
2855,General Knowledge,2,Physics,How many quarks are in an electron?,Three,Two,One,None,"Electrons are leptons, which are not made of quarks."
2866,General Knowledge,1,Physics,What kind of electromagnetic radiation arises only from nuclear excitations?,Microwaves,Ultraviolet Light,X-Rays,Gamma Rays,Gamma rays are ultra-high frequency light rays created when a nucleus relaxes from an excited state.
4772,General Knowledge,2,Biology,"What is the Japanese word for ""dog""?",Ichi,Apso,Dojo,Inu,Some Japanese dogs are the Akita-Inu and Shiba-Inu.
18066,General Knowledge,2,Astronomy,Which of Jupiter's moons is covered by active volcanoes?,Europa,Callisto,Ganymede,Io,"Io is caught between the gravity of Jupiter and the moon Europa, and this tug-of-war continually fuels the volcanoes on its surface."
18071,General Knowledge,2,Astronomy,What does the astronomical object called Charon orbit?,Jupiter,Saturn,Mars,Pluto,Pluto and it's moon Charon are close in size.
46914,General Knowledge,1,Animals,Which is the heaviest snake?,Reticulated Python,Indian Python,Boa Constrictor,Anaconda,Anaconda have been known to grow up to 80 feet long.
46990,General Knowledge,2,Animals,Which breed of dog is the tallest known breed?,Newfoundland,Borzoi,Russian Wolfhound,Irish Wolfhound,The Irish Wolfhound was first recorded in Ireland in 275 BC and almost became extinct in the early 1800's.
47418,General Knowledge,1,The Human Body,"When one suffers from Plantar Fasciitis , what part of the body is hurting?",Facial Skin,Throat,Lower Back,Feet,Plantar Fasciitis is an inflamed plantar muscle on the bottom of the foot.
48997,General Knowledge,3,Animals,Which goat has horns that resemble cork screws?,Saanen Goat,Nubian Goat,Rocky Mountain Goat,Suleiman Goat,The Suleiman Goat lives in Central Asia and is endangered.
54351,General Knowledge,3,Animals,Which Queen introduced the Pomeranian breed to England?,Queen Victoria,Queen Elizabeth I,Queen Mary,Queen Charlotte,Queen Charlotte brought the first Pomeranians with her to England upon her marriage to King George III.
76872,General Knowledge,2,Chemistry,What is the name of a hydrocarbon with two carbons sp^2 hybridized?,Ethadiene,Ethyne,Ethane,Ethene,sp^2 hybridization indicates a double bond between the carbons.
82290,General Knowledge,2,The Human Body,How many cervical vertebrae are there?,4,33,5,7,"There are 33 vertebrae in total in the human body, of which 7 are cervical."
90798,General Knowledge,2,Animals,What is a baby sea lion called?,Dray,Calf,Kit,Pup,Sea lion pups weigh between 13 and 20 pounds at birth.
103988,General Knowledge,2,General Science,At what temperature does water first boil?,1000 Degrees F.,100 Degrees F.,32 Degrees F.,212 Degrees F.,The boiling point of water changes slightly depending on air pressure.
189275,General Knowledge,1,Astronomy,"What is the study of stars, planets and galaxies called? ",Hygrometry,Nuclear Physics,Meteorology,Astronomy,Io is the explosive moon that orbits the planet Jupiter.
189285,General Knowledge,1,Earth Science,What do you call someone who studies earthquakes?,Albino,Vulcanologist,Petri Dish,Seismologist,Most professional seismologists are employed in the oil and natural gas industry.
189289,General Knowledge,1,Easy Science,What are the dark spots on the Sun that appear in 11-year cycles called?,Thrusters,Water Vapor,Aerobic,Sunspots,The existence of sunspots was first proved by Heinrich Schwabe in 1829.
189297,General Knowledge,1,Easy Science,What is a star known as after it has run out of energy and shut down?,Synga,Gasohol,Muscle,White Dwarf,Energy-less stars called white dwarfs are incredibly dense.
189350,General Knowledge,1,Physics,Which scientific term is defined as a physical particle with a negative charge?,Cloud Bank,Hair,Viscosity,Electron,The electron was first discovered by J.J. Thomson in 1897.
189470,General Knowledge,1,Earth Science,What is the study of plant life called?,Geography,Metallurgy,Zoology,Botany,The Smithsonian has its own botany department.
189531,General Knowledge,1,General Science,"What is a more scientific term for ""surrounding temperature""?",Breaking Point,Absolute Temperature,Heat Capacity,Ambient Air Temperature,"On a typical day on Mercury the early-afternoon temperature reaches a high of 800 degrees Fahrenheit, hot enough to melt zinc and tin."
189588,General Knowledge,1,General Science,What is the term given to heat and light radiated from the sun?,Solar Flares,Ambient Air Temperature,Greenhouse Gases,Solar Energy,"When solar energy passes through the Earth's atmosphere, six percent of it is reflected and 16% of it is absorbed. "
189692,General Knowledge,1,Earth Science,What is the height of the sea's surface generally called?,Elevation,Oil Shale,Cirriform,Sea Level,The sea level worldwide dropped during the 1990's.
189744,General Knowledge,2,General Science,"What does the scientist called a ""cytologist"" do?",Studies Atomic Nuclei,Works With Metal Alloys,Studies Stars,Studies Cells,Camilo Golgi is one of the more famous cytologists. 
217232,General Knowledge,2,General Science,What is the name for the branch-like tube that makes up the body of a fungus?,Parasite,Stem,Synapse,Hypha,"Fungi, the plural form of fungus, digest their food externally."
244799,General Knowledge,1,Animals,What type of animal is a guppy?,Bird,Mammal,Reptile,Fish,A guppy is a small fish that gives birth to live young rather than laying eggs.
245056,General Knowledge,1,Animals,Which type of animal is a tarantula?,Amphibian,Bird,Mammal,Arachnid,The greatest concentration of tarantulas is in South America.
250795,General Knowledge,1,General Science,What is force that resists the separation of two bodies in contact called?,Watt,File Transfer Protocol,Bug,Adhesion,Adhesion refers to a band of scar tissue that binds together two anatomic surfaces which usually are separated from each other.
252208,General Knowledge,3,Animals,"What kind of animal is a ""burbot""?",Monkey,Deer,Llama,Fish,A burbot is a freshwater member of the cod family.
254311,General Knowledge,1,General Science,What element does hydrogen combine with to make the compound water?,Helium,Carbon,Lithium,Oxygen,The chemical formula of water is H2O.
318191,General Knowledge,1,General Science,What is the common name of the chemical compound H2O?,Hydrogen Peroxide,Salt,Mercury,Water,Only about one percent of the Earth's water is drinkable. 
347645,General Knowledge,1,General Science,What is the longest bone in the human body?,Tibia,Ulna,Rib,Femur,Babies are born with more than 300 bones while adults usually have 206 or fewer.
351614,General Knowledge,1,Biology,Which nutrient group is used to help grow and repair cells?,Carbohydrates,Fats,Melanin,Proteins,"Ligaments, tendons, muscles, hair, nails and skin are made of protein, as is half of the non-water mass of your body."
366461,General Knowledge,1,Astronomy,What is the distance that light travels in a year called?,Leap Year,Normal Year,Parsec,Light Year,A light year is used to measure distances between stars. 
366539,General Knowledge,1,Chemistry,What is table salt's chemical name?,Hydrogen Peroxide,Ferrous Oxide,Halite Oxide,Sodium Chloride,The chemical formula for sodium chloride is NaCl and almost three percent of the weight of seawater is salt.
370032,General Knowledge,1,Biology,What is the cell where a virus reproduces called?,Hostile Cell,Hosta Cell,Homely Cell,Host Cell,"When a virus comes in contact with a host cell, the virus takes over and the host cell loses its regular duties."
390212,General Knowledge,1,Chemistry,"Relating to chemistry, what is a catalyst?",Invertor,Stone-Throwing Device,Classification Of Books,Reaction Agent,A catalyst causes the acceleration of a chemical change.
402683,General Knowledge,2,Weather,A gale is a strong what?,Cloudburst,Lunar Eclipse,Thunderstorm,Wind,Gale warnings are issued when winds of 34-47 knots are expected.
402690,General Knowledge,2,Weather,"Red sky in morning, sailors take what?",To Soaring,A Sweater,Two Aspirin Before Bed,Warning,"The term ""Mackerel Sky"" is given to a sky filled with rippled clouds that look like fish scales."
402696,General Knowledge,2,Weather,All atmospheric water that hits the ground is known as what?,Evaporation,Acid Rain,Condensation,Precipitation,"Drizzle, rain, snow and sleet are several of the different forms of precipitation."
402711,General Knowledge,2,Weather,"In weather terms, a ""Chinook"" is characterized by a warm what?",Eruption,Sunny Day,Trend,Wind,"Chinook winds are strong, dry winds found in the American West, where the prairies meet the mountains."
402723,General Knowledge,3,Weather,What September 1928 hurricane damaged Florida?,Katrina,Luke,Donna,Okeechobee,The Okeechobee hurricane in 1928 was the first to reach Category 5 in the Atlantic basin.
402773,General Knowledge,3,Weather,What is the federal weather agency in Canada called?,Canada Weather Service,Northern Lights,Canadian Snow Board,Environment Canada,Environment Canada is responsible for dealing with oil spills in addition to the weather.
402782,General Knowledge,1,Oceans,What ocean contains the Gulf Stream?,Pacific,North,Bering,Atlantic,The Gulf Stream sends warm water to Europe.
33972,General Knowledge,2,Technology,What company did Hyundai borrow technology from to launch its vehicles?,Toyota,Kia,Nissan,Mitsubishi,Hyundai used Mitsubishi-designed power train and suspension components until 1996.
2681,General Knowledge,1,Know The US States?,"Which state in the eastern U.S. is known as the ""Empire State""?",New Jersey,New Mexico,New Hampshire,New York,"Prosperous New York earned the nickname ""The Empire State""."
2694,General Knowledge,1,Know The US States?,In what state would you find the city of Kissimmee?,Arizona,Texas,Washington,Florida,"Kissimmee, Florida is near Disney World."
2727,General Knowledge,2,Know The US States?,Which U.S. state is known as the lightning capital?,New Hampshire,Kansas,Alaska,Florida,"More than one million lightning strikes occur in Florida every year, and usually 50 individuals are struck."
104334,General Knowledge,1,Know The US States?,Which U.S. state was named for William Penn?,South Carolina,Utah,Rhode Island,Pennsylvania,"The name Pennsylvania means ""Penn's Woods""."
201817,General Knowledge,2,U.S. Geography,"Where is ""Bed Stuy"" located?",Bedrock,Compton,Detroit,"Bedford Stuyvesant , NY","Bedford Stuyvesant, NY is in the borough of Brooklyn."
369399,General Knowledge,1,Alaska,What is the capital city of Alaska?,Anchorage,Cordova,Fairbanks,Juneau,Juneau is the only capital city in the U.S. that is accessible only by boat or plane.
35761,General Knowledge,3,U.S. Government - Executive Branch,"Which U.S. President was on the U.S. $100,000 bill?",Franklin Pierce,Harry Truman,Warren G. Harding,Woodrow Wilson,"Woodrow Wilson. Of course, they have been removed from circulation. It was just too hard to get change."
3713,General Knowledge,2,Civil War,"In which Civil War battle did ""Pickett's Charge"" occur?",Bull Run,Battle Of The Wilderness,Siege On Vicksburg,Gettysburg,Pickett's Charge in Gettysburg was a disaster for the South.
43632,General Knowledge,1,U.S. History,Who was the first U.S. President to be born in a hospital?,Dwight Eisenhower,Harry Truman,William McKinley,Jimmy Carter,Jimmy Carter lost his re-election bid for President.
71242,General Knowledge,1,U.S. History,President Harry Truman ordered the atomic bombing of which two Japanese cities?,Osaka And Tokyo,Tokyo And Nagasaki,Tokyo And Hiroshima,Hiroshima And Nagasaki,"A uranium bomb was dropped on Hiroshima in August 1945, followed a few days later by a plutonium bomb dropped on Nagasaki. "
89184,General Knowledge,2,U.S. History,What holiday is officially celebrated on October 12th in the United States?,England's Independence Day,George W. Bush's Birthday,President's Day,Columbus Day,"While Columbus is believed to be of Genoan origin, he sailed to the New World on behalf of Spain."
90173,General Knowledge,1,Politics,What was the name of the Clinton's pet cat?,Buttons,Charlie,Millie,Socks,"Socks was featured in a 1998 book about ""first pets"", written by Hillary Rodham Clinton."
385518,General Knowledge,1,Year By Year Trivia 1900's,"What was the name of Booker T. Washington's autobiography, published in 1901?",Roots,The Souls Of Black Folks,Native Son,Up From Slavery,"Booker T. Washington founded Alabama's Tuskegee Institute, which opened in 1881."
385721,General Knowledge,1,Year By Year Trivia 1900's,Fiorello LaGuardia was elected mayor of what city in 1933? ,Cleveland,Hollywood,Las Vegas,New York,The election of Fiorello LaGuardia as Mayor in 1933 put an end to the New York's corrupt Tammany Hall regime.
2754,General Knowledge,2,World Geography,Which continent is Benin on?,Asia,South America,Europe,Africa,Benin is a small country in Africa west of Nigeria.
36626,General Knowledge,3,World Geography,What is the highest mountain in North America?,Logan,Kennedy,Shasta,Denali,In recent years geographers have renamed Mt. McKinley to Denali to reflect its Eskimo origin.
38476,General Knowledge,1,World Geography,"Which former Soviet Republic was known as the ""Bread Basket of the Empire""?",Kazakhstan,Russia,Belarus,Ukraine,A large area of the Ukraine was contaminated by the disaster at the Chernobyl nuclear power plant.
38801,General Knowledge,3,World Geography,What is the capital of Nigeria?,Lagos,Ibadan,Nairobi,Abuja,Abuja is the administrative capital of Nigeria and Lagos is the commercial center.
38911,General Knowledge,3,World Geography,What is another name for the Helvetian Mountains?,Apennines,Dolomites,Pennines,Alps,The Helvetians derive their name from the Greek reference to this region.
42443,General Knowledge,1,World Geography,"Peru, the third largest country in South America, harbors which capital city?",Asuncion,Trujillo,Arequipa,Lima,"Lima, where the first lima bean was grown."
42630,General Knowledge,2,World Geography,Thimphu is the capital of which country?,Bangladesh,Tajikistan,Nepal,Bhutan,"Thimpu is the capital of the Kingdom of Bhutan, a tiny country in the Himalayas."
47513,General Knowledge,2,World Geography,What is the capital of Eritrea which was once a province of Ethiopia?,Asseb,Keren,Massawa,Asmera,"Since it became independent, Asmera is it's capital."
50911,General Knowledge,2,World Geography,Which capital city is situated on the River Liffey?,Helsinki,Edinburgh,Ottawa,Dublin,"The River Liffey flows through Ireland's capital city, Dublin."
56001,General Knowledge,2,World Geography,Which city is Seattle's sister city in Japan?,Tokyo,Osaka,Orix,Kobe,"Kobe is Sea-town's sister city, and their two soccer clubs play annual charity matches."
66208,General Knowledge,3,World Geography,What two countries share the worlds longest undefended land border?,Mexico & The United States,Peru & Brazil,Chile & Argentina,Canada & The United States,Canada and USA have not taken up arms against one another since 1812 before the confederation of Canada.
71028,General Knowledge,3,World Geography,On which continent are the Atlas Mountains?,Australia,Asia,Europe,Africa,"Located in Northwestern Africa, the Atlas Mountains are isolated mountains."
73191,General Knowledge,2,World Geography,Which South American country extends farthest east?,Guyana,Argentina,Surinam,Brazil,"The most eastern point of South America is Ponta do Seixas, Brazil, in Paraiba."
79311,General Knowledge,2,World Geography,Which country are the Canary Islands part of?,Morocco,France,Portugal,Spain,"Though only about sixty miles off the coast of Morocco, the island's belong to Spain."
82572,General Knowledge,1,World Geography,In which city will you find the Brandenburg Gate?,Nuremburg,Hamburg,Cologne,Berlin,The Brandenburg Gate is located on the Pariser Platz.
83443,General Knowledge,2,World Geography,What is the capital of the Canadian territory Nunavut?,St. Johns,Ottawa,Esquimalt,Iqaluit,Iqaluit is located on the southern tip of Baffin Island.
85188,General Knowledge,2,Australia,In which of Australia's capital cities is the suburb of Airport West?,Sydney,Hobart,Perth,Melbourne,"Airport West is located near Tullamarine Airport in Melbourne, Australia."
85908,General Knowledge,2,World Geography,Which region of Spain is Barcelona in?,Castille,Galicia,Andalusia,Catalonia,Barcelona is home to the culturally proud Catalans.
90870,General Knowledge,1,World Geography,What Cape will you find at the tip of Africa?,Cape Fear,Cape Gris-Nez,Cape Cod,Cape Of Good Hope,The Cape of Good Hope was rounded by Portuguese sailors in 1488 on their quest to find a new trade route to the Indies.
95904,General Knowledge,1,World Geography,Which Asian capital used to be called Peking?,Tokyo,Jakarta,Kuala Lumpur,Beijing,"Tiananmen Square is the largest urban square in the world, and was enlarged in the 1960's to accommodate up to one million people. "
103950,General Knowledge,2,World Geography,On which continent is China located?,North America,South America,Africa,Asia,"China is the fourth largest country in the world, after Russia, Canada, and the United States."
135711,General Knowledge,1,World Geography,Pago Pago is the capital of which country?,Greece,Costa Rica,Bahrain,American Samoa,"Tourism, entertainment, food, and tuna canning are the primary industries in Pago Pago."
180335,General Knowledge,1,World Landmarks,In which city is the Parthenon located?,"Washington, D.C.","Los Angeles, California","London, England","Athens, Greece",The Greek Parthenon was built to honor the goddess Athena and later served as both a church and a mosque.
233029,General Knowledge,2,World Geography,How many miles is it from Cuba to the U.S. mainland?,73,88,12,90,Before Castro there were USA owned Casinos in Cuba.
299970,General Knowledge,3,Tall Buildings,"In what city is the 1,046-foot Chrysler Building located?","Shanghai, China","Detroit, Michigan","Sydney, Australia","New York, New York","Built in 1930, the Chrysler Building in New York ranked 23rd in the world in height in 2006."
376425,General Knowledge,2,World Countries,Tourists often kiss what famous stone in Ireland?,Plymouth Rock,Hope Diamond,Stone Mountain,Blarney Stone,Kissing the Blarney Stone is said to give you the gift of eloquence.
376430,General Knowledge,1,World Countries,What country is bordered by Pakistan to the south and Iran to the west?,Turkey,Brazil,England,Afghanistan,Afghanistan is the source of the best lapis lazuli in the world.
376547,General Knowledge,1,World Countries,Mount Fuji is the highest point in what country?,Australia,Greece,Uganda,Japan,"The nation of Japan is composed of many islands, the largest being Honshu."
376548,General Knowledge,1,World Countries,"Mitsubishi, Sony and Toyota are all companies with roots in what country?",Cuba,Finland,Argentina,Japan,"In 2006, Japan exported more than one-fifth of its goods to the United States."
376839,General Knowledge,1,World Countries,In which country is the Copenhagen Airport located?,Cuba,Portugal,Germany,Denmark,"In Copenhagen there is a statue of Hans Christian Andersen's Little Mermaid, the national symbol of Denmark. "
3331,General Knowledge,1,World History,What was the name of the plane that dropped an atomic bomb on Hiroshima?,Memphis Belle B-17,Spirit Of America B-52,Spirit Of St. Louis B-2,Enola Gay B-29,"Paul Warfield Tibbets, Jr. was the pilot who dropped the bomb from the Enola Gay."
4190,General Knowledge,3,World History,In which year was the Irish Republican Army outlawed?,1966,1974,1905,1936,The IRA was first outlawed in 1936 and has remained outlawed ever since.
9397,General Knowledge,2,World History,What year did the Hindenburg disaster occur?,1944,1958,1905,1937,"The Hindenburg blew up at the U.S. Naval Base in Lakehurst, NJ on May 6, 1937."
54804,General Knowledge,2,World History,What was Josef Stalin's nationality?,Armenian,Russian,Ukrainian,Georgian,"Joseph Stalin was ""Time"" Magazine's Man of the Year in 1939."
58870,General Knowledge,3,World History,Who was the first President of Cameroon after independence?,Paul Biya,John Foncha,Idi Amin,Amadou Ahidjo,The French backed Amadou Ahijo over numerous other contenders seeking to lead Cameroon in 1960.
71131,General Knowledge,2,World History,What was the name of the world's first computer?,Hal 9000,Commodore 64,MS-DOS,ENIAC,ENIAC was the size of a full room and could only do addition.
95751,General Knowledge,2,World History,What was the first operational jet-fighter in history?,North American Sabre,Mig 15,Gloucester Meteor,Me 262,"The Me 262 is also called ""schwalbe"" which is German for ""swallow"" and also means ""diving"" in soccer."
104361,General Knowledge,1,World History,In which century was World War I?,18th,14th,21st,20th,World War I lasted from 1914 to 1918.
281708,General Knowledge,2,World Politics,Alberto Fujimori was the President of which country from 1990 to 2000?,Argentina,Chile,Brazil,Peru,"Fujimori resigned in the face of scandal, initially transmitting his resignation via fax machine from Japan."
