questionid,zone_name,diffrank,catname,question,answer1,answer2,answer3,right,response
350275,General Knowledge,2,World History,What precious gem was found to be plentiful in South Africa in the 1860's?,Ruby,Emerald,Sapphire,Diamond,Cecil Rhodes was the most famous miner during the South African diamond rush in the 1860's.
10668,Sports,2,MLB - New York Yankees,Who managed the 1961 New York Yankees?,Bill Virdon,Dick Howser,Casey Stengel,Ralph Houk,Ralph Houk managed the World Series championship Yankee team 1961.
13125,Sports,1,MLB World Series,How many home runs did Mark McGwire hit in the 1988 World Series?,2,5,0,1,"Mark McGwire had one home run in the 88' World Series and it was his only hit for the series, he batted .059."
13199,Sports,2,MLB World Series,In the 1978 World Series Tommy John pitched for which team?,Chicago White Sox,New York Yankees,"None, He Was Injured",L.A. Dodgers,"In 1978, Tommy John had an ERA of 3.30."
21902,Sports,1,Baseball,In what state did MLB's Kansas City Royals play their first game?,Texas,Minnesota,Maryland,Missouri,Kansas City was one of four cities chosen for an MLB expansion team to begin play in 1969.
260355,Sports,1,MLB - Chicago White Sox,Who averaged .310 to lead the White Sox in batting in 2004?,Shea Hillenbrand,Todd Helton,Alexis Rios,Aaron Rowand,Aaron Rowand went to college at Cal State Fullerton.
274164,Sports,3,MLB - Seattle Mariners,In what year did Lou Piniella become manager of the Seattle Mariners?,1992,1991,1994,1993,"In 2004, Lou Piniella led the Rays to an 11-8 record, their first-ever winning season in Grapefruit League play."
283052,Sports,2,Barry Bonds,What number did left-fielder Barry Bonds wear in the 2003 season?,44,42,24,25,"As a Pittsburgh Pirate, Barry Bonds wore #24, but changed to #25 when he joined the Giants because #24, Willie Mays' number, was retired."
288055,Sports,2,Baseball,What is the distance between bases in Major League Baseball?,113 feet,40 feet,85 feet,90 feet,This distance from the pitcher's mound to the home plate in Major League Baseball is 60 feet and 8 inches.
339047,Sports,3,MLB - San Diego Padres,What major operation did Trevor Hoffman have when he was six years old?,Eye Transplant,Extra Finger Removed,Eye Surgery,Kidney Removal,"Trevor Hoffman was an All-Star player in 1998, 1999, 2000, 2002 and 2006."
339125,Sports,2,MLB - Philadelphia Phillies,"In January 2007, who did the Philadelphia Phillies' Chase Utley marry?",Missy Moon,Jane Sorter,Lee Anne Cooper,Jennifer Cooper,"The day after his January 2007 wedding, Chase Utley signed an $85 million dollar contract with the Philadelphia Phillies."
339209,Sports,2,Jackie Robinson,What award did Jackie Robinson receive posthumously in 1984?,Presidential Medal Of Honor,Congressional Gold Medal,Presidential Citizens Medal,Presidential Medal Of Freedom,Jackie Robinson was awarded the Presidential medal of Freedom in 1984 and the Congressional gold medal in 2003.
339243,Sports,1,MLB - Baltimore Orioles,"In 2006, Miguel Tejada became only the 7th baseball player to do what?",Hit 600 Home Runs,Steal 500 Bases,"Drive in 2,000 Runs","Play 1,000 Consecutive Games","Miguel Tejada ended the 2006 season needing to play ten more consecutive years to tie Cal Ripken, Jr.'s record."
339246,Sports,3,Tom Glavine,Who did Tom Glavine replace on Opening Day 2006 at Shea Stadium?,Jon Adkins,John Maine,Livan Hernandez,Pedro Martinez,Tom Glavine won the Cy Young Award in 1991 and 1998.
339369,Sports,2,Luis Castillo,Luis Castillo had a hitting streak of how many games in 2002?,47,38,43,35,Luis Castillo ended up 21 games short of Joe DiMaggio's iconic hitting streak in 2002.
2420,Sports,3,Basketball,"Which basketball player's name means ""Little Warrior""?",Mahmoud Abdul-Rauf,Dikembe Mutombo,Hakeem Olajuwon,Shaquille Rashaun O'Neal,"Shaquille Rashaun O'Neal took his talent to the big-screen in the film ""Blue Chips"" opposite Nick Nolte, and the movie ""Kazaam""."
27865,Sports,2,NBA - Chicago Bulls,Who was Michael Jordan's first NBA coach?,Phil Jackson,Doug Collins,Tex Winters,Kevin Loughery,Kevin Loughery coached the Bulls from 1983-85.
87695,Sports,2,Wilt Chamberlain,"When Wilt Chamberlain led the NBA in scoring in 1962, what was his average?",30.5,40.7,32.9,50.4,Chamberlain averaged 30.1 points per game and 22.9 rebounds per game in his 14 year career.
98276,Sports,3,NBA - Minnesota Timberwolves,How tall is the NBA's Kevin Garnett?,"7' 1""",7',"6' 8""","6' 11""",Kevin Garnett weighs 220 pounds.
254244,Sports,2,Tim Duncan,How old was Tim Duncan when he first picked up a basketball to play?,3 Years Old,18 Years Old,5 Years Old,14 Years Old,Tim Duncan was born on St. Croix in the U.S. Virgin Islands and played college basketball at Wake Forest.
258326,Sports,2,Peja Stojakovic,Peja Stojakovic was born in what country?,Holland,Germany,Spain,Yugoslavia,Peja Stojakovic won the NBA's Three-point Shootout in 2002 and 2003.
258341,Sports,2,Basketball,Who was the first ever rookie to win the Sixth Man Award?,Tracy McGrady,Kobe Bryant,Allen Iverson,Ben Gordon,Ben Gordon was drafted third overall in the 2004 NBA Draft by the Chicago Bulls.
258455,Sports,2,Basketball,For what NBA team did Jerry Sloan become head coach in 1988?,Chicago Bulls,Detroit Pistons,Seattle SuperSonics,Utah Jazz,"In 2003, Jerry Sloan reached his 900th victory as an NBA coach."
271005,Sports,1,NBA - San Antonio Spurs,International basketball star Manu Ginobili comes from which nation?,Slovenia,Russia,Serbia,Argentina,Ginobili made his first professional debut in the Argentine basketball league.
271019,Sports,1,Basketball,International basketball star Marko Jaric hails from what nation?,Argentina,Brazil,France,Serbia,Marko Jaric was the 30th overall pick in the 2000 NBA Draft.
352539,Sports,2,NBA - Atlanta Hawks,Who led the Atlanta Hawks in field goal percentage in 2006-07?,Joe Johnson,Josh Smith,Tyronn Lue,Josh Childress,"In 2006-07, Atlanta Hawk Josh Childress averaged 13.0 points per game while shooting 50.5% in field goals."
352629,Sports,2,NBA - Atlanta Hawks,How many of the last 35 games of the 2004-05 season did the Atlanta Hawks win?,6,8,10,4,The Atlanta Hawks finished the 2004-05 season with their worst record to date of 13-69.
11117,Sports,1,Boxing,How old was Cassius Clay when he first fought Sonny Liston in Miami Beach?,17,19,21,22,"Cassius Clay was only 22 when he surprised the world by defeating Sonny Liston, even though he was a 7-1 underdog for the match."
12308,Sports,1,Boxing,Which boxer's real name is Arnold Cream?,Joe Louis,Jerry Quarry,Ken Norton,Joe Walcott,Jersey Joe Walcott turned pro in 1930 at the age of 16.
28301,Sports,1,Boxing,"Which heavyweight champion starred in the film ""Mandingo""?",George Foreman,Larry Holmes,Joe Frazier,Ken Norton,"Ken Norton also starred in the 1976 film ""Drum""."
59024,Sports,1,Muhammad Ali,How many times in his career did Muhammad Ali lose a professional boxing match?,4,3,2,5,"Ali lost 5 times to Joe Frazier, Ken Norton, Triver Berbick, Leon Spinks and Larry Holmes."
72063,Sports,2,Muhammad Ali,How many title defenses did Muhammad Ali make?,23,25,16,20,Ali had 20 defenses in his 3 title reign.
74576,Sports,1,Boxing,"Which boxer was nicknamed ""The Acorn""?",Ron Lyle,James Tillis,Lou Bailey,Ernie Shavers,Ernie Shavers was honored by the International Boxing Association as Puncher of the Century.
80863,Sports,2,Boxing,What was Archie Moore's real name?,Arnold Moore,Archie Moore,Archibald Lee Moore,Archibald Lee Wright,"Archie Moore was born in 1913 Archibald Lee Wright, but later changed his last name to Moore."
80865,Sports,2,Boxing,Who was the first man to beat Julio Cesar Chavez?,Meldrick Taylor,Willy Wise,Oscar De La Hoya,Frankie Randall,"Chavez's unbeaten streak ended January 29, 1994 when Frankie Randall won on a split decision."
80904,Sports,2,Boxing,Which boxer went the 10 round distance with Rocky Marciano twice?,Rex Applegate,Roland Lastarza,Don Mogard,Ted Lowry,"Applegate, Lastarza and Mogard went the distance with Marciano, but Lowry did it twice."
83438,Sports,3,Mike Tyson,Who was Mike Tyson's first professional opponent?,Lorenzo Canaday,Nate Tubbs,Jesse Furguson,Hector Mercedes,"Mike Tyson knocked out his first pro opponent, Hector Mercedes in the first round."
84742,Sports,1,Boxing,Which famous fighter was the first to release his own music album?,Sugar Ray Leonard,Felix Trinidad,Floyd Mayweather,Oscar De La Hoya,Oscar De La Hoya was nominated for a Latin Grammy Award.
87469,Sports,2,Mike Tyson,Which fighter was the first to finish a fight with Mike Tyson?,Sammy Scaff,Hector Mercedes,Mitch Green,James Tillis,"The Mike Tyson-James Tillis fight took place in Glen Falls, NY in 1985."
87639,Sports,3,Boxing,Where is the International Boxing Hall of Fame located?,"Las Vegas, NV","London, England","Detroit, MI","Canastota, NY","The idea for a Boxing Hall of Fame came from the town's love of its hometown boys Carmen Basilio, and his nephew Billy Backus."
88104,Sports,2,Mike Tyson,What round was Mike Tyson disqualified in for biting Holyfield's ear?,10th,7th,1st,3rd,Evander Holyfield would later speak with Mike Tyson and say there was no bad blood between the two.
323368,Sports,1,Boxing,"Boxer Arturo Gatti was raised in Canada, but where was he born?",United States,Austria,Greece,Italy,Boxer Arturo Gatti was training for the 1992 Olympics with the Canadian National Team when he decided to go pro.
404132,Sports,2,Alex Arthur,Alex Arthur became a World Champion in boxing 2007 after who vacated the title?,Ricky Burns,Koba Gogladze,Dariusz Snarlski,Joan Guzman,"When Joan Guzman gave up a World Champion boxing title to move up to the lightweight class, Alex Arthur inherited it. "
404134,Sports,1,Alex Arthur,What nationality is former World Boxing Champion Alex Arthur?,British,Irish,American,Scottish,"Boxing champ Alex Arthur was born in Edinburgh, Scotland, where he was also set to fight for the world title in 2008. "
404181,Sports,2,Barry McGuigan,In what year did Barry McGuigan first win the WBA Championship title?,1989,1995,1982,1985,Barry McGuigan's first World Boxing Association win was in 1985 after defeating Eusebio Pedroza.
10030,Sports,2,Florida Gator Football,Who was the first coach to lead the Florida Gators to the SEC Championship?,Ray Graves,Galen Hall,Jimmy Johnson,Steve Spurrier,Football's Steve Spurrier was the first to both win a Heisman and coach a Heisman winner.
76706,Sports,2,College Football,What college is QB Gus Frerotte from?,San Jose St.,California,Oregon State,Tulsa,"Gus Frerotte is an accomplished golfer, having scored a hole-in-one in high school and one in 1997."
10031,Sports,2,NFL - San Francisco 49ers,What number did John Taylor wear as a 49er?,80,81,83,82,John Taylor had 347 receptions for the 49ers in his career.
17885,Sports,2,NFL Super Bowl,Who won Super Bowl XX?,Washington Redskins,Kansas City Chiefs,San Francisco 49ers,Chicago Bears,The Chicago Bears came into existence as the Decatur Staleys in 1920.
58089,Sports,2,Football,What NFL team was the first to have 20 winning seasons in a row?,Miami Dolphins,San Francisco 49ers,Pittsburgh Steelers,Dallas Cowboys,"Super Bowl XXX was witnessed by 138.4 million television viewers, making it at the time the most watched event in television history."
63735,Sports,3,NFL Super Bowl,"Whitney Houston sang the ""National Anthem"" at which Super Bowl?","Super Bowl 24, 1989-90 Season","Super Bowl 23, 1988-89 Season","Super Bowl 20, 1985-86 Season","Super Bowl 25, 1990-91 Season",Houston sang the anthem during the Bills-Giants clash in Super Bowl 25.
64091,Sports,1,NFL - Green Bay Packers,What team did Green Bay acquire Brett Favre from?,Tampa Bay,Denver,Cincinnati,Atlanta,Brett Favre was drafted by the Falcons in '91 and was traded to Green Bay.
79562,Sports,2,NFL Super Bowl,Who coached the San Francisco 49ers in a blowout win in Super Bowl XXIV?,Steve Mariucci,Bill Walsh,Louis Degarrett,George Seifert,George Seifert coached the Niners to a 55-10 victory over Denver in his inaugural season.
88610,Sports,2,NFL - Dallas Cowboys,Who was the first owner of the Dallas Cowboys?,Bud Adams,Tex Schramm,Jerry Jones,Clint Murchison,"Clint Murchison, the Dallas Cowboys' first owner, hired Tom Landry as first head coach in 1960."
191490,Sports,2,NFL - Miami Dolphins,What former Miami Dolphins receiver stood trial for money laundering in 1999?,Oronde Gadsden,Nat Moore,Fred Banks,Tony Martin,Tony Martin totaled 9065 receiving yards during his NFL career despite being drafted as a quarterback.
199821,Sports,2,Pro Football Rules Terms,What is the penalty in the NFL for an illegal substitution?,Ten Yard Penalty,Twenty Yard Penalty,Fifteen Yard Penalty,Five Yard Penalty,"A NFL player may only enter the field during a dead ball, and must leave crossing their own sideline."
199844,Sports,3,Pro Football Rules Terms,How long is the typical halftime in the NFL?,30 Minutes,60 Minutes,20 Minutes,15 Minutes,Paul McCartney was one of the featured performers at the 2006 Super Bowl Halftime show.
199909,Sports,1,NFL - New York Giants,What New York Giant had his #11 uniform retired?,Lawrence Taylor,Spider Lockhart,Frank Gifford,Phil Simms,The New York Giants drafted Phil Simms during the 1st round of the 1979 NFL Draft.
200031,Sports,1,NFL - San Francisco 49ers,When was Joe Montana's first NFL season?,1958,1963,1988,1979,Joe Montana played for the Chiefs after playing for the 49ers.
200133,Sports,1,Football,What school did Russell Maryland play for?,Boston College,Air Force,Nebraska,"Miami, FL",University of Miami's Russell Maryland was the first overall pick by the Cowboys in 1991 and went on to win 3 Super Bowls with them.
231895,Sports,3,NFL Super Bowl,Where was Miami's winning Super Bowl VIII played?,"Miami, FL","Los Angeles, CA","Tampa Bay, FL","Houston, TX",Super Bowl VIII was the Miami Dolphins' third straight appearance in the NFL Championship game.
254230,Sports,2,Football,What NFL team released Jeff Garcia in February 2005?,San Francisco 49ers,Miami Dolphins,New York Jets,Cleveland Browns,NFL Quarterback Jeff Garcia was released from his contract with the Cleveland Browns in February of 2005.
256317,Sports,1,NFL - Cincinnati Bengals,Who was the second Heisman Trophy winner drafted by the Cincinnati Bengals?,Marco Battaglia,T.J. Duckett,Akili Smith,Carson Palmer,"Carson Palmer threw for 18 touchdowns in 2004, his first full season as a starter with the Bengals."
263209,Sports,3,NFL Super Bowl,Which Denver Bronco won the Super Bowl MVP Award in 1998? ,Marcus Nash,Bubby Brister,Terrell Davis,John Elway,"Pro Football Hall of Famer (2004) John Elway, named NFL MVP in 1987 earned the title again in 1998."
264431,Sports,3,NFL - Miami Dolphins,Who coached the Miami Dolphins in the year 2004?,Nick Saban,Dave Winfield,Jimmy Johnson,Jim Bates,Miami Dolphins 2004 coach Jim Bates has been their defensive coordinator for the past 5 seasons.
264521,Sports,3,Football,Who was named NFL Coach of the Year in 2000 and 2002?,Jim Haslett,Bill Cowher,Tom Coughlin,Andy Reid,Andy Reid took the Philadelphia Eagles to Super Bowl XXXIX in 2004.
293279,Sports,3,NFL Super Bowl,How many Super Bowl rings did Steve Young receive with the San Francisco 49ers?,1,2,4,3,Steve Young earned one Super Bowl ring as a starter with the 49ers and two as a backup for Joe Montana.
350731,Sports,2,NFL - Chicago Bears,What is Virginia McCaskey's relationship to Chicago Bears founder George Halas?,Wife,Granddaughter,Daughter-In-Law,Daughter,George Halas' Chicago Bears had only six losing records in 40 seasons.
350917,Sports,1,NFL - Atlanta Falcons,What is the name of the Atlanta Falcons' mascot?,Dirty Bird,Fannie Falcon,Frank Falcon,Freddie Falcon,Rookie Randy Johnson was the primary quarterback for the Atlanta Falcons in their inaugural season.
381746,Sports,2,2007 Football,Who led the NFL in rushing yards in the 2007 regular season?,Adrian Peterson,Willie Parker,Brian Westbrook,LaDainian Tomlinson,LaDainian Tomlinson's first NFL pass was a 21-yard throw to Drew Brees for a touchdown.
381754,Sports,1,2007 Football,Who had the highest NFL quarterback rating for the 2007 regular season?,Peyton Manning,Tony Romo,Brett Favre,Tom Brady,Tom Brady was one of only three quarterbacks who had a passer rating higher than 100 in 2007.
382743,Sports,2,2007 Football,Who was named the 2007 NFL Defensive Player of the Year?,Patrick Kerney,Albert Haynesworth,Mike Vrabel,Bob Sanders,Bob Sanders was invited to the Pro Bowl for the first time after the 2005 season.
500382,Sports,3,NFL 2012-13,The 2013 NFC Championship game was aired on what network?,CBS,ABC,NBC,Fox,The Seattle Seahawks defeated the San Francisco 49ers in the 2013 NFC Championship game.
502449,Sports,3,NFL 2012-13,On 2012 wild card weekend RG3 tore both his ACL and his LCL in a lose against who?,The Green Bay Packers,The New York Giants,The Chicago Bears,The Seattle Seahawks,The Seahawks defeated the Redskins by 10 in the 2012 wild card playoff.
502450,Sports,3,NFL 2012-13,On the 2012 wild card weekend who made his final appearance at M&T Bank Stadium?,Joe Flacco,Andrew Luck,Rex Ryan,Ray Lewis,Ray Lewis played college football at the University of Miami.
502594,Sports,1,NFL 2012-13,What year did The Meadowlands Giants Stadium close?,2001,2000,1995,2010,"The Meadowlands home to the New York Giants was located in East Rutherford, New Jersey."
502609,Sports,2,NFL 2012-13,"In the same year as ""Spygate"" what award did head coach of the Patriots Bill Belichick receive?",The Raspberry Award,The NFL Cheaters Award,The NFL Sneak Of The Year Award,NFL Coach of the Year Award,Spygate was the 2007 New England Patriots videotaping controversy.
506361,Sports,1,NFL - Seattle Seahawks,"Who said, ""I'm just here so I don't get fined."" about Super Bowl interviews in 2014?",Russell Wilson,Jermaine Kearse,Michael Bennett,Marshawn Lynch,Marshawn Lynch played college football at the University of California.
506365,Sports,2,NFL - Seattle Seahawks,What team scored the most points against the Seahawks in 2013?,Bucs,49ers,Vikings,Colts,In 2013 the Seahawks had a regular season record of 13-3.
510736,Sports,2,NFL - Pittsburgh Steelers,Who became the first team to score 55 points against the Steelers in 2013?,Buffalo Bills,Cincinnati Bengals,Denver Broncos,New England Patriots,The Steelers play their home games at Heinz Field. 
1181,Sports,1,Sports,What sport is a combination of surfing and snowboarding behind a boat?,Surfboarding,Waterboarding,Waveboarding,Wakeboarding,Wakeboarding is a fairly new sport that originated in the 1980's.
2335,Sports,3,Sports,For what track and field event is the hitch kick technique used?,Shotput,High Jump,Pole Vault,Long Jump,Two other long jump techniques are the stride and the hang.
2403,Sports,3,Sports,Who was the first male figure skater to land a triple loop in competition?,Scott Hamilton,Toller Cranston,Robin Cousins,Dick Button,"When Button was eleven, he wanted a pair of skates for Christmas, and got them."
6389,Sports,2,Golf,"Who wrote ""Golf for Dummies""?",Jack Nicklaus,Rodney Dangerfield,Harvey Penick,Gary McCord,Gary McCord has been a golf commentator on CBS.
43454,Sports,2,Soccer,"Who was Real Madrid's ""Blond Arrow"" of the 1950's and 1960's?",Kubala,Puskas,Gento,Di Stefano,"Alfredo Di Stefano was born July 4, 1926 in Barracas, Buenos Aires."
52205,Sports,3,Sports,Japanese archery is called what?,Nage Waza,Kobudo,Kenjutsu,Kyudo,"Kenjutsu is swordplay, Kobudo is the Okinawan art of weaponry and Nage Waza is a throw."
57642,Sports,2,Auto Racing,What speedway ended Bobby Allison's racing career?,Daytona,Watkins Glen,Dover,Pocono,Bobby Allison is a 3-time winner of Daytona 500 and a NASCAR National Champ and proud father of Davey.
62396,Sports,3,Golf,Who was the first father/son duo to play in the same PGA tour event?,Bob And David Duval,Jack And Gary Nicklaus,Jay And Hunter Haas,Al And Brent Geiberger,Al Geiberger was one of the few golfers ever to post a 59 in professional golf competition.
62582,Sports,3,Soccer,Who was the first woman to be inducted into the Soccer Hall of Fame?,Michelle Ackers,Mia Hamm,Brandi Chastain,April Heinrichs,April Heinrichs was the head coach at the University of Virginia in the USA.
71914,Sports,2,Sports,"Who was known as ""The Pottawatomie Giant""?",Jack Dempsey,Luis Firpo,George Foreman,Jess Willard,Jess Willard was considered very large for a heavyweight in his day.
74261,Sports,3,Formula Racing,Which island is the site of the Australian Formula One Grand Prix race?,Hunter Island,Kangaroo Island,French Island,Phillip Island,"Phillip Island, in Westernport Bay, east of Melbourne, is the venue for the annual Australian Formula One Grand Prix race."
83681,Sports,3,Sports,Who did Kabary Salem fight that died in a nationally televised bout?,Emilio Valdez,Bo James,Robby Jones,Randie Carver,Randie Carver was 24 years old when he died.
87961,Sports,3,Sports,"In billiards, what color is the 5 ball?",Blue,Red,Yellow,Orange,"In billiards, a red ball must be sunk between each colored ball."
88329,Sports,2,Sports,What sport did the Pope try to ban in the 15th Century?,Archery,Croquet,Swimming,Bullfighting,"In bullfighting, a veronica is a pass whereby the cape is drawn over the bull's head while the man holds a posture."
88465,Sports,3,Sports,In England they play a game called drafts; what is that game in America?,Backgammon,Monopoly,Hearts,Checkers,Checkers takes 2 players and the object is to capture the other players checkers to make it impossible for them to move.
88490,Sports,2,Golf,What is golfer Jack Nicklaus' nickname?,The Great One,Goldeneye,The Golden Hat,The Golden Bear,"Jack Nicklaus earned his nickname ""The Golden Bear"" because of his prominent mane of blonde hair."
88878,Sports,2,Auto Racing,Who won back-to-back Indy 500's in 1953 and 1954?,Mauri Rose,Wilbur Shaw,Rodger Ward,Bill Vukovich,Bill Vukovich became a racing legend for capturing the AAA National Midget crown and winning two Indy 500 races.
89889,Sports,3,Sports,Before 1980 the record for the high jump was what height?,7 Feet 1/2 Inches,8 Feet 4 Inches,6 Feet 5 Inches,7 Feet 8 1/2 Inches,"In 1993, the high jump record was increased to 8 feet 5 inches by Javier Sotomayor."
96820,Sports,1,Soccer,What is the name of the top soccer league in Germany?,Deutschgamen,Germanliga,Deutschlagen,Bundesliga,Germany's National Bundesliga soccer league was formed in 1963.
104102,Sports,2,Auto Racing,How many miles long is the Indianapolis 500 car race?,1000,100,200,500,The Indianapolis Motor Speedway was built on 328 acres of farmland five miles northwest of Indiana's capital city in the spring of 1909.
119746,Sports,1,Sports,Which sport is Jean-Claude Killy famous for?,Diving,Fencing,Baseball,Skiing,Jean-Claude Killy is a 2-time World Cup Champion (1967-68) who won 3 gold medals at 1968 Olympics in Grenoble.
186906,Sports,1,Soccer,"Who scored the so-called ""Hand of God"" goal in the World Cup of 1986?",Batistuta,Sanchez,Figo,Maradona,"Diego Maradona scored the ""Hand of God"" goal to tie Argentina 1-1 with England in 1986."
186948,Sports,1,Soccer,"In soccer, what is the name of the Mark located inside the Center Circle?",Sideline,Goal Area,Corner Arc,Center Mark,"The name soccer comes from an abbreviation of the sport's official name ""association football""."
218240,Sports,2,Sports,Eskimo roll is a term most commonly used in which sport?,Fencing,Skiing,Water Polo,Canoeing/Kayaking,"The term ""Eskimo Roll"" was named after the Eskimo people who first developed kayaks and the skill of rolling."
227813,Sports,2,Soccer,Which English team plays their home games at Molineux?,Brentford,Birmingham City,Walsall,Wolverhampton Wanderers,"The Wolverhampton Wanderers play in Molineux, Whitmore Reans."
228429,Sports,2,Golf,What is the minimum depth of the hole in professional golf?,Nine Inches,12 Inches,Two Inches,Four Inches,The golf hole must also be four and one-half inches in diameter.
228640,Sports,3,Golf,Which golfer got a double eagle at Augusta in 1994?,Bruce Devlin,Corey Pavin,Willie Goggin,Jeff Maggert,"In 1994, Jeff Maggert became only the third golfer to hit a double eagle at Augusta."
229004,Sports,1,Golf,Who won the U.S. and British Opens in 1982?,Fred Couples,Mark O'Meara,Joe Durant,Tom Watson,Tom Watson is a member of the World Golf Hall of Fame.
229061,Sports,1,Golf,Who became the first Canadian to lead the Order of Merit since 1989?,Rick Acton,Brett Ogle,Isao Aoki,Mike Weir,Royal Shakespeare won the 2005/06 Order of Merit with 87 points.
229117,Sports,2,Golf,"Which golfer is nicknamed ""El Nino""?",Tom Watson,Mark O'Meara,Johnny Miller,Sergio Garcia,"Sergio Garcia, who has been called ""El Nino"" since he was 14 would prefer his nickname to drop from use and to just be called ""Sergio""."
229120,Sports,1,Golf,Who won the British Open in 1973 and was a two-time runner-up at the Masters?,Jim Albus,Butch Baird,Stuart Appleby,Tom Weiskopf,"In the 1970's, Tom Weiskopf was given the nickname ""Towering Inferno"" because of his short temper."
229398,Sports,2,Golf,"Which golfer is nicknamed ""Cinderella""?",Karrie Webb,Sophie Gustafson,Bettye Danoff,Shi Hyun Ahn,Shi Hyun Ahn turned pro in 2002.
230229,Sports,3,Auto Racing,"Who wrote the book ""Lifetime Going Around in Circles""?",Kyle Petty,Dale Earnhardt,Davey Allison,Darrell Waltrip,"Darrell Waltrip came in first in the Winston Cup in 1981, 1982 and 1985."
285131,Sports,1,Golf,What course played host to the 2006 U.S. Open?,Pebble Beach,Baltusrol,Augusta National,Winged Foot,The 2006 U.S. Open was the sixth major and the fifth U.S. Open to be held at Winged Foot.
285143,Sports,3,Golf,What course played host to the 2006 British Open?,Carnoustie,Prestwick,St. Andrews,Royal Liverpool,The 2006 Open represents the first time Liverpool has hosted in 39 years.
